{
  "schema_version": "1",
  "slug": "agent-copywriting",
  "name": "Agent: Copywriting",
  "type": "agent",
  "status": "done",
  "summary": "Turns a guided interview into copy that's ready to publish — for any brand, any market, never translated word for word.",
  "last_updated": "2026-07-20",
  "objectives": [
    "Turn a guided interview into channel-ready copy — for any brand, any market — instead of a blank page.",
    "Stop a copy claim that can't be backed before it ships — a check that fails closed, not one that hopes someone notices.",
    "Re-create copy for each market so it reads native, never translate it word for word."
  ],
  "outcomes": [
    {
      "text": "Anyone can download the agent and run it: a guided interview becomes copy for organic social, ads, email, landing pages and video scripts.",
      "evidence": [
        { "label": "The agent", "url": "https://github.com/oegit/agent-copywriting" },
        { "label": "The steps it follows", "url": "https://github.com/oegit/agent-copywriting/blob/main/core/WORKFLOW.md" }
      ]
    },
    {
      "text": "Copy with a claim that can't be backed does not ship. The claims check fails closed — an unverified stat or promise holds the copy until a person validates it.",
      "evidence": [
        { "label": "The claims gate", "url": "https://github.com/oegit/agent-copywriting/blob/main/core/QA_GATE.md" }
      ]
    },
    {
      "text": "It never translates word for word. Copy is rebuilt for each market so it reads native — Latin America, Spain, Brazil, Turkey — with a person approving the adaptation.",
      "evidence": [
        { "label": "How it adapts per market", "url": "https://github.com/oegit/agent-copywriting/blob/main/core/TRANSCREATION.md" }
      ]
    },
    {
      "text": "It runs for any brand, not one. The published agent carries no client's private setup — the brand's own configuration lives apart, so the same agent serves whoever loads it."
    },
    {
      "text": "It proved itself end to end before going live: a full dry run across every channel passed, and campaign copy now routes to it."
    }
  ],
  "milestones": [
    { "title": "Put the whole copy craft into one portable agent — principles, workflow, the interview", "state": "done" },
    { "title": "Build the claims gate that fails closed, so unbacked copy can't ship", "state": "done" },
    { "title": "Write the market modules so copy is rebuilt, never translated, for each region", "state": "done" },
    { "title": "Set up the first brand as its own configuration, kept apart from the shared agent", "state": "done" },
    { "title": "Prove it end to end with a full dry run across every channel", "state": "done" },
    { "title": "Publish the agent so anyone can download and run it, with no private setup inside", "state": "done" },
    { "title": "Route campaign copy tasks to it in the shared workspace", "state": "done" }
  ]
}
