{
  "schema_version": "1",
  "slug": "agent-landing-page-ab-testing",
  "name": "Agent: Landing Page A/B Testing",
  "type": "agent",
  "status": "on hold",
  "summary": "Tests the landing page over and over so it keeps learning what works — and stops to ask a person at the points where judgment beats a rule.",
  "last_updated": "2026-07-27",
  "objectives": [
    "Keep testing the landing page, non-stop, so it keeps learning what works.",
    "Learn two things separately: what brings leads, and what brings sales.",
    "A person decides the idea, the creative and the winner. The agent does everything in between.",
    "When a message wins, use it beyond the page that proved it."
  ],
  "outcomes": [
    {
      "text": "The whole loop is written down: eight steps from idea to reusing the winner, with the points marked where a person decides. Someone who did not build it can run it.",
      "evidence": [
        { "label": "How to run it", "url": "https://oegit.github.io/oe-docs/landing-page-ab-testing-ops-guide.html" }
      ]
    },
    {
      "text": "It was walked end to end on a practice run before being pointed at anything real: every document produced, every approval enforced, and nothing sent outside."
    },
    {
      "text": "Meeting the real testing tool changed the plan — and the plan was corrected, rather than the reality. Publishing a test by hand is now a normal path with its own instructions, instead of the case the agent had assumed away."
    },
    {
      "text": "The rule for picking a winner now follows the math the testing tool actually reports, instead of a number the plan had borrowed from a different kind of test. That number would have looked official and meant nothing."
    },
    {
      "text": "The correction reached the screen people actually read. The approval screen had kept printing the old word beside the number — the one place a colleague not doing the math would believe it. The wording is no longer typed in by hand: the screen derives it from the kind of test the tool runs."
    }
  ],
  "milestones": [
    { "title": "Write the eight-step loop, from idea to reusing the winner", "state": "done" },
    { "title": "Put every setting in a file per deployment, so the agent stays portable", "state": "done" },
    { "title": "Build the dashboard where a person approves the idea, the creative and the winner", "state": "done" },
    { "title": "Walk the whole loop on a practice run", "state": "done" },
    { "title": "Write the instructions for publishing and reading a test by hand", "state": "done" },
    { "title": "Publish the guide, so someone who did not build it can run it", "state": "done" },
    { "title": "Get access to the analytics account that reports the results — what the project is waiting on, and the last piece before a real test can run", "state": "next" },
    { "title": "Run the first real test on a live page", "state": "next" }
  ]
}
